{
  "$schema": "./localizations.schema.json",
  "schemaVersion": 1,
  "specVersion": "1.0.0",
  "status": "stable",
  "profiles": [
    {
      "id": "ru-Cyrl",
      "languageTag": "ru",
      "script": "Cyrl",
      "direction": "ltr",
      "role": "display-alias",
      "method": "phonemic-transcription",
      "caseTransform": "capitalize-first-codepoint",
      "reverseMapping": "unique-within-profile",
      "review": {
        "status": "stable",
        "evidence": [
          {
            "kind": "expert-review",
            "citation": "Большая российская энциклопедия — «Транскрипция»: practical transcription transfers foreign names/terms through the target-language alphabet and may map phonemes directly when no source spelling is relevant",
            "url": "https://old.bigenc.ru/linguistics/text/4199684"
          },
          {
            "kind": "orthographic-reference",
            "citation": "Грамота.ру / Правила русской орфографии — §2 «Буквы а — я, у — ю»: я represents [j]+[a] at word start and after vowels",
            "url": "https://gramota.ru/biblioteka/spravochniki/pravila-russkoy-orfografii-i-punktuatsii/bukvy-a-ya-u-yu"
          },
          {
            "kind": "orthographic-reference",
            "citation": "Грамота.ру / Правила русской орфографии — §11 «Буквы и — ы»: и represents /i/ while also marking softness of a preceding paired consonant",
            "url": "https://gramota.ru/biblioteka/spravochniki/pravila-russkoy-orfografii-i-punktuatsii/bukvy-i-y"
          }
        ]
      },
      "syllableMap": {
        "MA": "ма", "MI": "ми", "MU": "му",
        "NA": "на", "NI": "ни", "NU": "ну",
        "SA": "са", "SU": "су", "TA": "та",
        "YA": "я", "KA": "ка", "ZU": "зу"
      },
      "aliases": [
        {"month": 1, "full": "Масанумика", "short6": "Масану", "short4": "Маса"},
        {"month": 2, "full": "Тасузунуму", "short6": "Тасузу", "short4": "Тасу"},
        {"month": 3, "full": "Назумасану", "short6": "Назума", "short4": "Назу"},
        {"month": 4, "full": "Микасумани", "short6": "Микасу", "short4": "Мика"},
        {"month": 5, "full": "Янимузуну", "short6": "Яниму", "short4": "Яни"},
        {"month": 6, "full": "Зумитанасу", "short6": "Зумита", "short4": "Зуми"},
        {"month": 7, "full": "Муясануми", "short6": "Муяса", "short4": "Муя"},
        {"month": 8, "full": "Сунизусака", "short6": "Сунизу", "short4": "Суни"},
        {"month": 9, "full": "Нуманамута", "short6": "Нумана", "short4": "Нума"},
        {"month": 10, "full": "Казунусуя", "short6": "Казуну", "short4": "Казу"},
        {"month": 11, "full": "Яназумаса", "short6": "Яназу", "short4": "Яна"},
        {"month": 12, "full": "Санумиказу", "short6": "Сануми", "short4": "Сану"},
        {"month": 13, "full": "Нимутазуна", "short6": "Нимута", "short4": "Ниму"}
      ],
      "notes": "References-reviewed Russian Cyrillic practical transcription. MI/NI written ми/ни normally palatalize the preceding Russian consonant (/mʲi, nʲi/); this is an explicit language-specific approximation of broad canonical /mi, ni/, not a change to Tredecadia identity. YA maps naturally to я for /ja/ after vowels or at word start."
    },
    {
      "id": "ja-Kana",
      "languageTag": "ja",
      "script": "Kana",
      "direction": "ltr",
      "role": "display-alias",
      "method": "phonemic-transcription",
      "caseTransform": "none",
      "reverseMapping": "unique-within-profile",
      "review": {
        "status": "stable",
        "evidence": [
          {
            "kind": "standards-reference",
            "citation": "Agency for Cultural Affairs, Japan — 外来語の表記 (Cabinet Notification No. 2, 1991), kana table and principles for foreign words and foreign proper names",
            "url": "https://www.bunka.go.jp/kokugo_nihongo/sisaku/joho/joho/kijun/naikaku/gairai/"
          }
        ]
      },
      "syllableMap": {
        "MA": "マ", "MI": "ミ", "MU": "ム",
        "NA": "ナ", "NI": "ニ", "NU": "ヌ",
        "SA": "サ", "SU": "ス", "TA": "タ",
        "YA": "ヤ", "KA": "カ", "ZU": "ズ"
      },
      "aliases": [
        {"month": 1, "full": "マサヌミカ", "short6": "マサヌ", "short4": "マサ"},
        {"month": 2, "full": "タスズヌム", "short6": "タスズ", "short4": "タス"},
        {"month": 3, "full": "ナズマサヌ", "short6": "ナズマ", "short4": "ナズ"},
        {"month": 4, "full": "ミカスマニ", "short6": "ミカス", "short4": "ミカ"},
        {"month": 5, "full": "ヤニムズヌ", "short6": "ヤニム", "short4": "ヤニ"},
        {"month": 6, "full": "ズミタナス", "short6": "ズミタ", "short4": "ズミ"},
        {"month": 7, "full": "ムヤサヌミ", "short6": "ムヤサ", "short4": "ムヤ"},
        {"month": 8, "full": "スニズサカ", "short6": "スニズ", "short4": "スニ"},
        {"month": 9, "full": "ヌマナムタ", "short6": "ヌマナ", "short4": "ヌマ"},
        {"month": 10, "full": "カズヌスヤ", "short6": "カズヌ", "short4": "カズ"},
        {"month": 11, "full": "ヤナズマサ", "short6": "ヤナズ", "short4": "ヤナ"},
        {"month": 12, "full": "サヌミカズ", "short6": "サヌミ", "short4": "サヌ"},
        {"month": 13, "full": "ニムタズナ", "short6": "ニムタ", "short4": "ニム"}
      ],
      "notes": "Standards-reviewed Katakana display transcription. Japanese realization of canonical /u/ and /z/ remains an expected language-specific approximation; no native-speaker review is claimed by this evidence."
    },
    {
      "id": "ko-Hang",
      "languageTag": "ko",
      "script": "Hang",
      "direction": "ltr",
      "role": "display-alias",
      "method": "phonemic-transcription",
      "caseTransform": "none",
      "reverseMapping": "unique-within-profile",
      "review": {
        "status": "stable",
        "evidence": [
          {
            "kind": "standards-reference",
            "citation": "National Institute of Korean Language — 외래어 표기법, Ministry of Culture Notice No. 2017-14: IPA-to-Hangul table and semivowel [j] rule",
            "url": "https://www.korean.go.kr/kornorms/m/m_regltn.do?regltn_code=0003"
          }
        ]
      },
      "syllableMap": {
        "MA": "마", "MI": "미", "MU": "무",
        "NA": "나", "NI": "니", "NU": "누",
        "SA": "사", "SU": "수", "TA": "타",
        "YA": "야", "KA": "카", "ZU": "주"
      },
      "aliases": [
        {"month": 1, "full": "마사누미카", "short6": "마사누", "short4": "마사"},
        {"month": 2, "full": "타수주누무", "short6": "타수주", "short4": "타수"},
        {"month": 3, "full": "나주마사누", "short6": "나주마", "short4": "나주"},
        {"month": 4, "full": "미카수마니", "short6": "미카수", "short4": "미카"},
        {"month": 5, "full": "야니무주누", "short6": "야니무", "short4": "야니"},
        {"month": 6, "full": "주미타나수", "short6": "주미타", "short4": "주미"},
        {"month": 7, "full": "무야사누미", "short6": "무야사", "short4": "무야"},
        {"month": 8, "full": "수니주사카", "short6": "수니주", "short4": "수니"},
        {"month": 9, "full": "누마나무타", "short6": "누마나", "short4": "누마"},
        {"month": 10, "full": "카주누수야", "short6": "카주누", "short4": "카주"},
        {"month": 11, "full": "야나주마사", "short6": "야나주", "short4": "야나"},
        {"month": 12, "full": "사누미카주", "short6": "사누미", "short4": "사누"},
        {"month": 13, "full": "니무타주나", "short6": "니무타", "short4": "니무"}
      ],
      "notes": "Standards-reviewed Hangul display transcription derived from the official IPA-to-Hangul table. Korean ㅈ is the prescribed foreign-word representation of source /z/ before a vowel and remains a localization approximation of canonical ZU /zu/."
    }
  ]
}
